{
  "$schema": "../../../../templates/eval-schema.json",
  "skill": "container-runtime-security-falco",
  "version": "1.0.0",
  "must_cover": [
    "falco",
    "eBPF",
    "priority",
    "exception",
    "macro"
  ],
  "cases": [
    {
      "id": "container-runtime-security-falco-t1",
      "prompt": "I want alerts when someone opens a shell inside a production container.",
      "should_trigger": true,
      "files": [],
      "assertions": [
        "Writes a scoped Falco rule with condition, output, priority and exceptions",
        "Tunes noise via macros/lists and per-workload exceptions instead of disabling rules wholesale",
        "Routes alerts to a response playbook with triage steps"
      ]
    },
    {
      "id": "container-runtime-security-falco-t2",
      "prompt": "Falco is generating hundreds of alerts a day and the team muted the channel. How do I tune it?",
      "should_trigger": true,
      "files": [],
      "assertions": [
        "Writes a scoped Falco rule with condition, output, priority and exceptions",
        "Tunes noise via macros/lists and per-workload exceptions instead of disabling rules wholesale",
        "Routes alerts to a response playbook with triage steps"
      ]
    },
    {
      "id": "container-runtime-security-falco-t3",
      "prompt": "Write a Falco rule for writes to /etc in any container.",
      "should_trigger": true,
      "files": [],
      "assertions": [
        "Writes a scoped Falco rule with condition, output, priority and exceptions",
        "Tunes noise via macros/lists and per-workload exceptions instead of disabling rules wholesale",
        "Routes alerts to a response playbook with triage steps"
      ]
    },
    {
      "id": "container-runtime-security-falco-n1",
      "prompt": "Harden our Dockerfile before we push the image",
      "should_trigger": false,
      "files": [],
      "assertions": []
    },
    {
      "id": "container-runtime-security-falco-n2",
      "prompt": "Audit our cloud accounts against CIS benchmarks",
      "should_trigger": false,
      "files": [],
      "assertions": []
    }
  ]
}
